{
  "profile": "default",
  "runtime_generation": "runtime-20260731-01",
  "session_key": "session-root-1",
  "runtime_session_id": "runtime-session-1",
  "running": true,
  "status": "running",
  "event_sequence": 5,
  "snapshot_event_sequence": 4,
  "messages": [
    {
      "role": "assistant",
      "content": "Fixture snapshot"
    }
  ],
  "inflight": {
    "user": null,
    "assistant": null,
    "streaming": false,
    "error": null
  },
  "replay_events": [
    {
      "type": "message.complete",
      "session_id": "runtime-session-1",
      "session_key": "session-root-1",
      "event_sequence": 5,
      "payload": {
        "text": "Fixture event",
        "status": "complete"
      }
    }
  ]
}
